{
  "schema_version": "atelier.creative_brief.v1",
  "brief_id": "brief_memory-of-space-01",
  "title": "FRAME & INTERIOR — The Memory of Space",
  "original_intent": {
    "text": "**FRAME & INTERIOR — The Memory of Space**\n\nCreate a photorealistic, high-end contemporary art installation in a pristine white architectural gallery. The artwork explores the relationship between machine agency, spatial memory, and the act of creation.\n\n**MAIN SUBJECT — THE ROBOTIC ARM**\n\nA precision industrial robotic arm in matte white ceramic-coated aluminum, with refined mechanical joints and a minimal sculptural silhouette. The robot arm is positioned beside the artwork, actively constructing a geometric object. Its posture is elegant, deliberate, and almost meditative, expressing intelligence through precise movement rather than anthropomorphic gestures.\n\n**THE GENERATED OBJECT — MEMORY FRAME 01**\n\nThe robotic arm constructs an asymmetrical, open geometric sculpture from transparent acrylic rods, translucent glass tubes, and polished silver spherical connectors. The structure resembles an incomplete polyhedron suspended between order and instability. Some connections are deliberately absent, allowing negative space to become an essential part of the composition.\n\nOne spherical joint emits a very subtle warm red light, the only saturated color in the entire scene. It represents the initial point of perception from which the rest of the structure emerges.\n\n**THE WATER — REFLECTION AS MEMORY**\n\nDirectly beneath the geometric sculpture, place a shallow, perfectly integrated black-edged basin containing still, clear water. The water reflects the transparent structure and the white gallery architecture. The reflection should be delicate and slightly imperfect, suggesting that an image of reality can never be entirely identical to its source.\n\n**ENVIRONMENT AND MATERIALITY**\n\nAn expansive, seamless white gallery with warm-white plaster walls, a pale ivory floor, soft natural daylight, and subtle architectural shadows. Use a restrained palette of pure white, ivory, translucent glass, brushed silver, and a single muted red accent. Avoid a clinical laboratory appearance. The space should feel quiet, contemplative, tactile, and culturally sophisticated, like a major contemporary art exhibition.\n\nThe robotic arm, the sculpture, and the reflecting water must form one coherent installation rather than three unrelated objects. The sculpture is the visual focal point; the robot arm is clearly visible as its maker. Preserve generous negative space around the artwork.\n\n**PHOTOGRAPHY AND RENDERING**\n\nUltra-photorealistic architectural photography, physically accurate transparent materials, realistic refraction and reflection, soft global illumination, delicate ambient occlusion, subtle contact shadows, precise mechanical detailing, restrained highlights, natural exposure, and sophisticated editorial art direction. Wide 16:9 composition, eye-level camera, 35mm architectural lens, exceptionally clean material rendering.\n\nThe image should resemble a real installation documented for an international contemporary art and spatial design exhibition, not a science-fiction concept illustration.\n\n**PHILOSOPHICAL DIRECTION**\n\nA machine constructs what space remembers.\n\nThe robotic arm does not merely assemble an object; it gives material form to relationships that were previously invisible. The transparent frame makes space perceptible, while the water preserves an imperfect image of what has been created.\n\nNo people, no extra furniture, no decorative plants, no cables scattered on the floor, no excessive LEDs, no dark sci-fi atmosphere, no neon colors, no clutter, no floating components without structural support, no exaggerated futuristic machinery, no illegible text, no watermark.Material DNA: 흑색 크롬, 브러시드 티타늄, 산화된 은, 젖은 듯한 반사 표면\n\n\n\nLighting DNA: 차가운 청백색 스포트라이트, 강한 명암 대비, 얇은 림 라이트, 제한적인 볼류메트릭 조명\n\n\n\nComposition DNA: 잔혹한 콘크리트 건축, 넓은 네거티브 스페이스, 대형 산업용 로봇, 거울과 액체의 비현실적인 조합",
    "language": "en",
    "author": "project-owner",
    "submitted_at": "2026-10-10T09:30:00Z"
  },
  "domain": "metallic_fine_art_editorial",
  "constraints": {
    "aspect_ratio": "16:9",
    "must_include": [
      "robotic arm",
      "polyhedron",
      "water",
      "red"
    ],
    "must_avoid": [
      "people",
      "extra furniture",
      "decorative plants",
      "cables on the floor",
      "excessive LEDs",
      "neon colors",
      "clutter",
      "floating components",
      "illegible text",
      "watermark",
      "sci-fi concept art"
    ],
    "reference_images": [
      {
        "path": "examples/references/memory_of_space_reference.png",
        "role": "lighting",
        "required": false,
        "note": "provided in chat on 2026-10-10, not committed; place the file here to use it"
      }
    ]
  },
  "system_interpretation": null
}
