{
  "schema_version": "atelier.creative_brief.v1",
  "domain": "metallic_fine_art_editorial",
  "system_interpretation": null,
  "brief_id": "brief_steel-light-01",
  "title": "Materiality A: brushed stainless steel under a luminous ceiling",
  "original_intent": {
    "text": "이제 다음 두 개의 물성으로 작품을 만들 것이다 각각 1개씩",
    "language": "ko",
    "author": "project-owner",
    "submitted_at": "2026-10-10T12:00:00Z"
  },
  "constraints": {
    "aspect_ratio": "16:9",
    "must_include": [],
    "must_avoid": [
      "people",
      "text",
      "watermark",
      "logo"
    ],
    "reference_images": [
      {
        "path": "examples/references/steel_bar_luminous_ceiling.png",
        "role": "material",
        "required": false,
        "note": "materiality to work from: brushed stainless monolith, diffuse backlit ceiling grid, matte white walls, grey concrete floor; one artwork from this materiality"
      }
    ]
  }
}
